{"brief":{"created_at":"2026-07-31T20:00:00+00:00","markdown":"**Regime: Risk-off** — rotazione verso i difensivi: difesa ed energia europee guidano, mentre i semiconduttori USA arretrano sul taglio delle stime di capex sull'AI.\n\n## Sintesi del giorno\n- **USA:** S&P 500 +0.6%, Nasdaq 100 -0.2%; small-cap Russell 2000 +1.2% in controtendenza.\n- **Europa:** DAX +0.7%, FTSE MIB +0.8%, CAC 40 +0.3% — banche e difesa in spolvero.\n- **Asia:** Hang Seng +1.1% e Shanghai +0.9% in rialzo; Nikkei -0.5%, KOSPI -0.3% deboli.\n- **Settori:** **Difesa +2.4%** ed **Energia +1.8%** i migliori; **Semiconduttori -1.1%** il peggiore.\n- **Tassi e banche centrali:** UST 10Y al **4.75%** (+0.07); Fed al **3.625%** (taglio), **BoE 3.75%** (taglio), **BCE 2.25%** (rialzo), **BoJ 1.00%** (rialzo), PBoC ferma al 3.00%.\n- **In evidenza:** Rheinmetall +3.4% traina la difesa europea; Bitcoin **$63.120** (+1.4%).\n\n## Cosa tenere d'occhio\n**Breve termine (trading)**\n- Momentum sulla difesa (DFEN, ITA) sulla scia della forza europea.\n- SMH vicino al supporto dopo il calo dei semiconduttori.\n- WTI in area $78-80: rottura da monitorare.\n\n**Lungo termine (investimento)**\n- Staples e industriali stabili, trend intatto.\n- Esposizione a difesa ed energia via UCITS europei che allarga la leadership.\n- Crypto costruttiva sopra il range precedente.\n"},"cb_events":[{"as_of":"2025-12-11","bank":"Fed","change_bp":-25,"direction":"cut","rate":3.625,"series_id":"USFED","source":"BIS"},{"as_of":"2026-06-17","bank":"BCE","change_bp":25,"direction":"hike","rate":2.25,"series_id":"ECBDFR","source":"BIS"},{"as_of":"2025-12-18","bank":"BoE","change_bp":-25,"direction":"cut","rate":3.75,"series_id":"BOEBR","source":"BIS"},{"as_of":"2026-06-17","bank":"BoJ","change_bp":25,"direction":"hike","rate":1.0,"series_id":"BOJPR","source":"BIS"},{"as_of":null,"bank":"PBoC","change_bp":0,"direction":"hold","rate":3.0,"series_id":"PBOCLPR1Y","source":"BIS"}],"crypto":[{"as_of":"2026-07-31T20:00:00+00:00","currency":"USD","eur":54758.393337,"last":63120.0,"name":"Bitcoin","quality":"OK","ret_1d":1.4,"ret_5d":3.2,"source":"yfinance","spark":[61162.7907,61483.9504,61459.4518,61249.1138,61285.8339,61641.2665,61919.7012,61837.2912,61638.7762,61739.9007,62117.9758,62343.9569,62210.7456,62037.6168,62203.2802,62590.4693,62756.6168,62582.217,62447.0229,62674.3065,63056.4639,63158.1284,62954.2344,62867.9],"ticker":"BTC-USD"},{"as_of":"2026-07-31T20:00:00+00:00","currency":"USD","eur":1624.360198,"last":1872.4,"name":"Ethereum","quality":"OK","ret_1d":0.9,"ret_5d":2.6,"source":"yfinance","spark":[1824.9513,1834.056,1832.8488,1826.1026,1826.725,1836.8454,1844.6678,1841.74,1835.3576,1837.8992,1848.683,1854.937,1850.5044,1844.888,1849.3481,1860.3914,1864.8617,1859.2138,1854.7342,1861.021,1871.9034,1874.4567,1867.9434,1864.9217],"ticker":"ETH-USD"},{"as_of":"2026-07-31T20:00:00+00:00","currency":"USD","eur":63.50308,"last":73.2,"name":"Solana","quality":"OK","ret_1d":2.1,"ret_5d":4.8,"source":"yfinance","spark":[69.8473,70.2629,70.2835,70.0913,70.1815,70.6369,71.0044,70.9582,70.7783,70.9424,71.4249,71.7328,71.6274,71.4757,71.7142,72.2083,72.4478,72.294,72.1851,72.4951,72.9846,73.1497,72.9607,72.9076],"ticker":"SOL-USD"},{"as_of":"2026-07-31T20:00:00+00:00","currency":"USD","eur":0.936931,"last":1.08,"name":"XRP","quality":"OK","ret_1d":-0.6,"ret_5d":1.1,"source":"yfinance","spark":[1.0682,1.0729,1.0715,1.0668,1.0665,1.0717,1.0756,1.0732,1.0688,1.0696,1.0752,1.0781,1.0748,1.0709,1.0728,1.0785,1.0804,1.0765,1.0732,1.0761,1.0818,1.0825,1.0781,1.0757],"ticker":"XRP-USD"},{"as_of":"2026-07-31T20:00:00+00:00","currency":"USD","eur":506.896851,"last":584.3,"name":"BNB","quality":"OK","ret_1d":0.7,"ret_5d":1.9,"source":"yfinance","spark":[573.4053,576.0908,575.537,573.245,573.267,576.2692,578.549,577.4572,575.2835,575.9077,579.1138,580.8997,579.3391,577.4092,578.6336,581.9166,583.1427,581.2052,579.6343,581.4283,584.6569,585.2831,583.0792,581.9663],"ticker":"BNB-USD"}],"earnings":[{"date":"2026-08-03","eps_estimate":1.95,"name":"Exxon Mobil","sector":"Oil & Gas","source":"yfinance","ticker":"XOM"},{"date":"2026-08-04","eps_estimate":1.9,"name":"Alphabet","sector":"Internet & Platforms","source":"yfinance","ticker":"GOOGL"},{"date":"2026-08-05","eps_estimate":1.42,"name":"Apple","sector":"Tech Hardware / Semis","source":"yfinance","ticker":"AAPL"},{"date":"2026-08-06","eps_estimate":4.85,"name":"Caterpillar","sector":"Infrastructure & Industrials","source":"yfinance","ticker":"CAT"},{"date":"2026-08-07","eps_estimate":6.1,"name":"Eli Lilly","sector":"Healthcare & Pharma","source":"yfinance","ticker":"LLY"},{"date":"2026-08-10","eps_estimate":0.98,"name":"NextEra Energy","sector":"Utilities & Power","source":"yfinance","ticker":"NEE"},{"date":"2026-08-12","eps_estimate":0.82,"name":"Coca-Cola","sector":"Consumer Staples","source":"yfinance","ticker":"KO"},{"date":"2026-08-14","eps_estimate":5.4,"name":"Rheinmetall","sector":"Defense & Aerospace","source":"yfinance","ticker":"RHM.DE"}],"etfs":[{"as_of":"2026-07-31T20:00:00+00:00","currency":"EUR","eur":112.4,"last":112.4,"name":"Xtrackers S&P 500 Equal Weight","quality":"OK","ret_1d":0.5,"ret_5d":1.2,"source":"yfinance","spark":[111.0672,111.5534,111.4124,110.935,110.9057,111.4528,111.8599,111.6151,111.1615,111.2486,111.8343,112.1455,111.8107,111.4049,111.6078,112.2075,112.4104,112.0036,111.6677,111.9801,112.5685,112.6557,112.1983,111.9511],"ticker":"XDEW.DE"},{"as_of":"2026-07-31T20:00:00+00:00","currency":"EUR","eur":48.9,"last":48.9,"name":"Xtrackers MSCI EM (acc)","quality":"OK","ret_1d":0.8,"ret_5d":1.9,"source":"yfinance","spark":[47.9882,48.213,48.1666,47.9748,47.9767,48.2279,48.4187,48.3273,48.1454,48.1977,48.466,48.6154,48.4848,48.3233,48.4258,48.7005,48.8031,48.641,48.5095,48.6597,48.9299,48.9823,48.7978,48.7047],"ticker":"XMME.DE"},{"as_of":"2026-07-31T20:00:00+00:00","currency":"EUR","eur":168.7,"last":168.7,"name":"iShares Core Euro Stoxx 50","quality":"OK","ret_1d":0.6,"ret_5d":1.5,"source":"yfinance","spark":[166.2069,166.9563,166.7669,166.0739,166.0516,166.8924,167.5237,167.1788,166.5208,166.6729,167.572,168.06,167.5798,166.9931,167.3187,168.2394,168.5652,167.9766,167.4942,167.9842,168.8884,169.0408,168.3758,168.0262],"ticker":"SXRT.DE"},{"as_of":"2026-07-31T20:00:00+00:00","currency":"EUR","eur":128.3,"last":128.3,"name":"Vanguard FTSE All-World (acc)","quality":"OK","ret_1d":0.4,"ret_5d":1.1,"source":"yfinance","spark":[126.9041,127.4541,127.2874,126.7365,126.6975,127.317,127.7765,127.4914,126.9678,127.0618,127.7253,128.0752,127.6874,127.2185,127.4447,128.124,128.3502,127.8802,127.4912,127.8424,128.5087,128.6028,128.0752,127.7876],"ticker":"VWCE.DE"},{"as_of":"2026-07-31T20:00:00+00:00","currency":"USD","eur":21.341199,"last":24.6,"name":"iShares Latin America 40","quality":"OK","ret_1d":1.0,"ret_5d":2.2,"source":"yfinance","spark":[24.0705,24.1863,24.1662,24.0731,24.0772,24.2064,24.3053,24.2625,24.1743,24.2037,24.3415,24.4197,24.3572,24.2792,24.3338,24.4749,24.5296,24.4512,24.3882,24.4668,24.6058,24.6352,24.5455,24.5017],"ticker":"ILF"},{"as_of":"2026-07-31T20:00:00+00:00","currency":"USD","eur":486.683439,"last":561.0,"name":"SPDR S&P 500","quality":"OK","ret_1d":0.6,"ret_5d":1.4,"source":"yfinance","spark":[553.2544,555.7249,555.0702,552.7399,552.6416,555.4158,557.4929,556.321,554.1076,554.5898,557.5576,559.1572,557.5358,555.5599,556.6192,559.6582,560.7181,558.7365,557.1082,558.7142,561.6978,562.1808,559.9457,558.7594],"ticker":"SPY"},{"as_of":"2026-07-31T20:00:00+00:00","currency":"USD","eur":432.37616,"last":498.4,"name":"Invesco QQQ (Nasdaq 100)","quality":"OK","ret_1d":-0.2,"ret_5d":0.9,"source":"yfinance","spark":[493.9544,496.0523,495.3603,493.1738,492.9793,495.3467,497.0917,495.9396,493.8599,494.1831,496.7207,498.0386,496.4877,494.622,495.4588,498.0572,498.8936,497.0242,495.4699,496.7921,499.3386,499.6615,497.5691,496.4094],"ticker":"QQQ"},{"as_of":"2026-07-31T20:00:00+00:00","currency":"USD","eur":241.953674,"last":278.9,"name":"Vanguard Total Stock Market","quality":"OK","ret_1d":0.5,"ret_5d":1.3,"source":"yfinance","spark":[275.3208,276.5382,276.2004,275.029,274.9682,276.3365,277.3579,276.763,275.65,275.8779,277.3423,278.1261,277.3077,276.3131,276.8281,278.3276,278.8428,277.8455,277.024,277.8107,279.2824,279.5107,278.3877,277.7861],"ticker":"VTI"},{"as_of":"2026-07-31T20:00:00+00:00","currency":"USD","eur":196.668691,"last":226.7,"name":"iShares Russell 2000","quality":"OK","ret_1d":1.2,"ret_5d":2.0,"source":"yfinance","spark":[222.2549,223.3055,223.1005,222.2217,222.2398,223.4133,224.3068,223.8932,223.0599,223.3116,224.5643,225.2665,224.6709,223.932,224.4164,225.6992,226.1843,225.4424,224.8426,225.548,226.8099,227.0624,226.2169,225.7946],"ticker":"IWM"},{"as_of":"2026-07-31T20:00:00+00:00","currency":"USD","eur":193.805847,"last":223.4,"name":"SPDR Gold Shares","quality":"OK","ret_1d":0.3,"ret_5d":0.7,"source":"yfinance","spark":[221.8471,222.7699,222.4398,221.4388,221.3322,222.3758,223.1399,222.6035,221.6508,221.7767,222.8962,223.4684,222.7533,221.8971,222.2533,223.3997,223.7556,222.898,222.1818,222.7556,223.8782,224.0038,223.0467,222.5077],"ticker":"GLD"},{"as_of":"2026-07-31T20:00:00+00:00","currency":"USD","eur":23.683526,"last":27.3,"name":"iShares Silver Trust","quality":"OK","ret_1d":0.6,"ret_5d":1.4,"source":"yfinance","spark":[26.9231,27.0433,27.0114,26.898,26.8933,27.0283,27.1293,27.0723,26.9646,26.9881,27.1325,27.2103,27.1314,27.0353,27.0868,27.2347,27.2863,27.1899,27.1106,27.1888,27.334,27.3575,27.2487,27.191],"ticker":"SLV"},{"as_of":"2026-07-31T20:00:00+00:00","currency":"USD","eur":81.721176,"last":94.2,"name":"iShares 20+ Year Treasury Bond","quality":"OK","ret_1d":-0.4,"ret_5d":-1.1,"source":"yfinance","spark":[95.2477,95.5691,95.3528,94.8494,94.7296,95.1017,95.3537,95.05,94.5691,94.5487,94.9515,95.1206,94.7419,94.3037,94.3811,94.7935,94.87,94.4323,94.055,94.2239,94.6244,94.6031,94.1249,93.8238],"ticker":"TLT"},{"as_of":"2026-07-31T20:00:00+00:00","currency":"USD","eur":69.055262,"l